number,value,datetime_start,datetime_complete,duration,params_criterion,params_max_depth,params_max_features,params_min_samples_leaf,params_min_samples_split,params_n_estimators,state
0,0.9333333333333333,2026-01-20 20:36:28.386905,2026-01-20 20:36:29.154539,0 days 00:00:00.767634,gini,20,sqrt,6,15,81,COMPLETE
1,0.9333333333333333,2026-01-20 20:36:29.156100,2026-01-20 20:36:30.151049,0 days 00:00:00.994949,entropy,2,sqrt,9,20,145,COMPLETE
2,0.9333333333333333,2026-01-20 20:36:30.152613,2026-01-20 20:36:30.797601,0 days 00:00:00.644988,gini,7,,2,13,92,COMPLETE
3,0.9238095238095239,2026-01-20 20:36:30.799167,2026-01-20 20:36:31.563622,0 days 00:00:00.764455,gini,13,,7,2,108,COMPLETE
4,0.9333333333333333,2026-01-20 20:36:31.565448,2026-01-20 20:36:32.098287,0 days 00:00:00.532839,gini,3,log2,5,15,68,COMPLETE
5,0.9333333333333333,2026-01-20 20:36:32.099522,2026-01-20 20:36:33.045140,0 days 00:00:00.945618,gini,7,log2,6,11,136,COMPLETE
6,0.9333333333333333,2026-01-20 20:36:33.047117,2026-01-20 20:36:33.942607,0 days 00:00:00.895490,entropy,19,,2,3,124,COMPLETE
7,0.9333333333333333,2026-01-20 20:36:33.946192,2026-01-20 20:36:34.583430,0 days 00:00:00.637238,gini,7,,2,12,78,COMPLETE
8,0.9333333333333333,2026-01-20 20:36:34.584940,2026-01-20 20:36:34.791562,0 days 00:00:00.206622,entropy,17,sqrt,8,15,11,COMPLETE
9,0.9333333333333333,2026-01-20 20:36:34.792799,2026-01-20 20:36:35.689273,0 days 00:00:00.896474,gini,8,log2,4,3,129,COMPLETE
10,0.9333333333333333,2026-01-20 20:36:35.691072,2026-01-20 20:36:36.942635,0 days 00:00:01.251563,entropy,15,sqrt,10,7,190,COMPLETE
11,0.9238095238095239,2026-01-20 20:36:36.946181,2026-01-20 20:36:38.002640,0 days 00:00:01.056459,entropy,2,sqrt,10,20,163,COMPLETE
12,0.9428571428571428,2026-01-20 20:36:38.004423,2026-01-20 20:36:38.550400,0 days 00:00:00.545977,entropy,20,sqrt,8,20,45,COMPLETE
13,0.9333333333333333,2026-01-20 20:36:38.551986,2026-01-20 20:36:38.915428,0 days 00:00:00.363442,entropy,20,sqrt,7,17,40,COMPLETE
14,0.9333333333333333,2026-01-20 20:36:38.916840,2026-01-20 20:36:39.282998,0 days 00:00:00.366158,gini,16,sqrt,4,18,31,COMPLETE
15,0.9333333333333333,2026-01-20 20:36:39.284403,2026-01-20 20:36:39.734856,0 days 00:00:00.450453,entropy,18,sqrt,8,8,50,COMPLETE
16,0.9333333333333333,2026-01-20 20:36:39.736388,2026-01-20 20:36:40.238811,0 days 00:00:00.502423,entropy,13,sqrt,6,17,64,COMPLETE
17,0.9333333333333333,2026-01-20 20:36:40.240026,2026-01-20 20:36:40.992508,0 days 00:00:00.752482,gini,20,sqrt,4,15,97,COMPLETE
18,0.9238095238095239,2026-01-20 20:36:40.995002,2026-01-20 20:36:41.269952,0 days 00:00:00.274950,entropy,14,sqrt,8,18,12,COMPLETE
19,0.9428571428571428,2026-01-20 20:36:41.271092,2026-01-20 20:36:41.699388,0 days 00:00:00.428296,gini,11,log2,5,10,48,COMPLETE
20,0.9428571428571428,2026-01-20 20:36:41.700867,2026-01-20 20:36:42.165763,0 days 00:00:00.464896,entropy,10,log2,1,9,52,COMPLETE
21,0.9428571428571428,2026-01-20 20:36:42.166969,2026-01-20 20:36:42.605076,0 days 00:00:00.438107,entropy,10,log2,1,9,51,COMPLETE
22,0.9428571428571428,2026-01-20 20:36:42.606578,2026-01-20 20:36:42.952738,0 days 00:00:00.346160,entropy,11,log2,1,6,29,COMPLETE
23,0.9333333333333333,2026-01-20 20:36:42.953960,2026-01-20 20:36:43.399808,0 days 00:00:00.445848,entropy,9,log2,3,10,53,COMPLETE
24,0.9333333333333333,2026-01-20 20:36:43.401262,2026-01-20 20:36:43.684591,0 days 00:00:00.283329,entropy,11,log2,5,5,24,COMPLETE
25,0.9333333333333333,2026-01-20 20:36:43.686116,2026-01-20 20:36:44.212998,0 days 00:00:00.526882,entropy,5,log2,9,13,68,COMPLETE
26,0.9428571428571428,2026-01-20 20:36:44.214643,2026-01-20 20:36:44.598317,0 days 00:00:00.383674,gini,12,log2,3,9,42,COMPLETE
27,0.9333333333333333,2026-01-20 20:36:44.599767,2026-01-20 20:36:45.416817,0 days 00:00:00.817050,entropy,10,log2,7,11,112,COMPLETE
28,0.9333333333333333,2026-01-20 20:36:45.418288,2026-01-20 20:36:46.016316,0 days 00:00:00.598028,gini,5,log2,3,5,79,COMPLETE
29,0.9333333333333333,2026-01-20 20:36:46.017499,2026-01-20 20:36:46.534129,0 days 00:00:00.516630,gini,15,log2,9,8,60,COMPLETE
30,0.9238095238095239,2026-01-20 20:36:46.535729,2026-01-20 20:36:47.266226,0 days 00:00:00.730497,entropy,12,,5,13,85,COMPLETE
31,0.9428571428571428,2026-01-20 20:36:47.267519,2026-01-20 20:36:47.726844,0 days 00:00:00.459325,entropy,9,log2,1,9,43,COMPLETE
32,0.9428571428571428,2026-01-20 20:36:47.730995,2026-01-20 20:36:48.089610,0 days 00:00:00.358615,entropy,10,log2,1,9,30,COMPLETE
33,0.9333333333333333,2026-01-20 20:36:48.091081,2026-01-20 20:36:48.525527,0 days 00:00:00.434446,entropy,9,log2,2,10,48,COMPLETE
34,0.9428571428571428,2026-01-20 20:36:48.527632,2026-01-20 20:36:49.105102,0 days 00:00:00.577470,entropy,11,log2,1,12,74,COMPLETE
35,0.9333333333333333,2026-01-20 20:36:49.106316,2026-01-20 20:36:49.592346,0 days 00:00:00.486030,entropy,13,log2,3,7,58,COMPLETE
36,0.9333333333333333,2026-01-20 20:36:49.594469,2026-01-20 20:36:49.871114,0 days 00:00:00.276645,gini,6,,2,10,21,COMPLETE
37,0.9333333333333333,2026-01-20 20:36:49.872391,2026-01-20 20:36:50.532857,0 days 00:00:00.660466,entropy,10,log2,6,14,95,COMPLETE
38,0.9428571428571428,2026-01-20 20:36:50.534539,2026-01-20 20:36:51.164410,0 days 00:00:00.629871,gini,14,log2,9,11,86,COMPLETE
39,0.9142857142857144,2026-01-20 20:36:51.165605,2026-01-20 20:36:51.543786,0 days 00:00:00.378181,entropy,8,,7,7,37,COMPLETE
40,0.9428571428571428,2026-01-20 20:36:51.547050,2026-01-20 20:36:52.084071,0 days 00:00:00.537021,gini,12,log2,1,12,69,COMPLETE
41,0.9333333333333333,2026-01-20 20:36:52.085334,2026-01-20 20:36:52.368609,0 days 00:00:00.283275,entropy,11,log2,2,6,21,COMPLETE
42,0.9428571428571428,2026-01-20 20:36:52.369811,2026-01-20 20:36:52.720454,0 days 00:00:00.350643,entropy,8,log2,1,4,31,COMPLETE
43,0.9333333333333333,2026-01-20 20:36:52.722300,2026-01-20 20:36:53.215209,0 days 00:00:00.492909,entropy,11,log2,2,8,55,COMPLETE
44,0.9333333333333333,2026-01-20 20:36:53.217152,2026-01-20 20:36:53.426537,0 days 00:00:00.209385,entropy,13,log2,1,6,10,COMPLETE
45,0.9428571428571428,2026-01-20 20:36:53.429750,2026-01-20 20:36:53.804755,0 days 00:00:00.375005,entropy,10,sqrt,2,6,37,COMPLETE
46,0.9333333333333333,2026-01-20 20:36:53.806131,2026-01-20 20:36:54.847325,0 days 00:00:01.041194,entropy,18,log2,4,3,158,COMPLETE
47,0.9238095238095239,2026-01-20 20:36:54.848845,2026-01-20 20:36:55.360238,0 days 00:00:00.511393,gini,6,,8,9,49,COMPLETE
48,0.9333333333333333,2026-01-20 20:36:55.362880,2026-01-20 20:36:56.581382,0 days 00:00:01.218502,entropy,14,sqrt,10,8,190,COMPLETE
49,0.9333333333333333,2026-01-20 20:36:56.583208,2026-01-20 20:36:56.924512,0 days 00:00:00.341304,entropy,8,log2,5,20,27,COMPLETE
